,Submitted at,Nom du Scout,Prenom,Nom,Position,Pied,Aperçu,Comment
297,2024-02-02 08:04:23,Noël Antoine Sagna,YOANN,COURT,Ailier,Gauche,B- Suivi,"Qualité technique, joueur vif, rapide, tonique, jeu en mouvement, bonne qualité de pied, capable de jouer avec les autres, de percuter et se projeter , d'éliminer balle au pied, de faire la dernière passe."
298,2024-02-02 08:55:33,Noël Antoine Sagna,PRESTIGE,MBOUNGOU,Ailier,Droit,C- Potentiel,"Joueur vif, tonique, efficace surtout lorsqu'il est en mouvement, capable de déborder, aime le 1/2 pour ensuite percuter ou se projeter balle au pied, joueur très collectif, il est assez adroit devant les buts."
299,2024-02-02 10:50:57,Noël Antoine Sagna,FADIGA,BANDIOUGOU,Ailier,Droit,C- Potentiel,"Joueur percutant, va vite, jeu tonique et vif qui amène de la vitesse, beaucoup de courses et d'appels, efforts défensif, ca manque malgré tout de maitrise technique, même si il est capable par moments de se créer des occasions demandant une certaine maitrise, ca engendre des pertes de balles. Son jeu a besoin d'espace, ou il fait preuve d'un peu plus de maitrise."
300,2024-02-05 14:22:23,Noël Antoine Sagna,YOAN,KORE,Central,Droit,B- Suivi,"Défenseur technique, bonne relance, capable d'utiliser ses 2 pieds pour ressortir proprement la balle sur du jeu court ou long, défense debout, pressing sur l'adversaire en laissant peu d'espace, bon jeu de tête, bonne couverture des espaces, solide dans les duels.
Après ca manque d'anticipation, niveaux vitesse et vivacité c'est moyen , d'où certaines difficultés dans le 1/1 quand ca va vite."
301,2024-02-05 14:31:53,Noël Antoine Sagna,FADIGA,BANDIOUGOU,Ailier,Droit,C- Potentiel,"Joueur rapide, vif beaucoup de courses et d'appels, percute ,amène de la vitesse au jeu, joueur plein d'énergie, tout en vitesse et tonicité, capable de faire les efforts défensif.
Manque un peu de maitrise technique, un peu brouillon par moment, doit apprendre à mieux situer ses coéquipiers pour combiner et ne pas choisir la solution individuelle lorsque ca manque d'espace, alors que soin jeu à besoin d'espace."
302,2024-02-05 14:37:42,Noël Antoine Sagna,LONI,QUENABIO,Central,Droit,C- Potentiel,"Bon défenseur, à l'aise dans les 1/1 ou il en ressort souvent gagnant, bon dans le placement, récupère pas mal de ballons, relance propre sur une passe ou sortie balle au pied pour apporter le surnombre, sait joueur au ballon , joueur intelligent.
Coté lacunes, ca parait manquer de vitesse, d'explosivité, et de vivacité ;
Profil intéressant"
303,2024-02-06 08:16:53,Noël Antoine Sagna,AMINE,KHECHE,6,Droit,D- Vu ,PAS DE VIDEOS POUR JUGER
304,2024-02-06 09:17:30,Noël Antoine Sagna,ELIAS,SPAGO,Central,Gauche,D- Vu ,"Défenseur moyen, relance moyenne , duels correct, vitesse moyenne ."
305,2024-02-06 10:10:37,Noël Antoine Sagna,MARIUS,CORBU,8,Droit,B- Suivi,"Joueur propre, intelligent, qualité technique, vision du jeu, facile dans les phases de transitions, il peut attaquer, défendre, que ce soit dans l'axe ou sur un coté, très disponible, il offre toujours une solution à ses coéquipiers pour relancer le jeu de derrière, ou trouver une passe vers l'attaquant.
 Perd peu de ballons, joue juste, simple et efficace, joueur très actif il a une bonne vision de jeu et joue juste.
SUPER PROFIL"
306,2024-02-06 11:38:27,Noël Antoine Sagna,MOHAMED AZZIZ,ABID,Attaquant,Droit,C- Potentiel,"Joueur rapide, technique, plein d'énergie, jeu vers l'avant, prise de profondeur, débordement."
307,2024-02-06 12:14:29,Noël Antoine Sagna,ADEM,OUERTANI,6,Droit,C- Potentiel,"Joueur technique, parait avoir une belle et grosse frappe de balle."
308,2024-02-06 13:10:43,Noël Antoine Sagna,MOHAMED,NASRAOUI,Central,Droit,D- Vu ,"Défenseur avec une relance correcte, moyen dans le 1/1, parait en difficulté quand il y a de la vitesse, pas grand chose à voir pour le moment."
309,2024-02-06 14:09:58,Noël Antoine Sagna,GUILLERMO,MAY,Attaquant,Gauche,C- Potentiel,"Qualité technique, parait avoir un bon pied gauche et un bon jeu de tête, très actif, beaucoup de courses, travail défensif, accrocheur et agressif dans les duels."
310,2024-02-07 08:26:21,Noël Antoine Sagna,PABLO,GALDAMES,6,Droit,B- Suivi,"Qualités technique, bonne orientation du jeu, agressif dans les duels, facile sur ses prises de balles orientés dos au jeu, milieu récupérateur très offensif.
Profil très intéressant"
311,2024-02-07 10:23:16,Noël Antoine Sagna,LEVAN,OSIKMASHVILI,6,Droit,C- Potentiel,"Joueur très accrocheur, agressif dans les duels, constamment au pressing, récupère pas mal de ballon, assez bonne relance, capable d'orienter le jeu, manque de puissance."
312,2024-02-08 08:35:18,Noël Antoine Sagna,SALIFOU,SOUMAH,Attaquant,Gauche,B- Suivi,"Jeune joueur de 20 ans, qualités techniques, de dribble, rapide, cherche beaucoup la profondeur que ce soit balle au pied, ou dans la passe, voit vite et bien le jeu.
Super profil"
315,2024-02-08 11:42:08,Noël Antoine Sagna,VIANA FILHO,RICARDO,Attaquant,Droit,C- Potentiel,"Jeune joueur intéressant de par son sens du but, joueur de surface, besoin d'être alimenté en ballon, sa qualité technique est moyenne, il parvient rarement à éliminer sur un dribble et faire la différence tout seul . Son jeu dos au but est correct, il frappe de n'importe ou et dans n'importe quelle position malgré une qualité de frappe moyenne.
Parfois tendance à oublier ses coéquipiers dans ces moments là.
Après ca manque de vitesse, de puissance, sa protection de balle est a travailler, son jeu de tête moyen aussi .
Jeune joueur qui peut encore progresser dans certains domaines."
316,2024-02-08 12:35:03,Noël Antoine Sagna,YOUSEF,SALECH,Attaquant,Droit,C- Potentiel,"Joueur de surface , besoin d'être bien entouré pour recevoir des ballons, bon jeu de tête, puissant, techniquement adroit, il peut être intéressant si il vient a mieux finir ses occasions. Son manque de vitesse, de vivacité et de vitesse d'exécution assez visible, il peut être efficace sur du jeu en pivot, de déviation , son champ d'action doit être dans la surface pour mieux exploiter ses qualités."
317,2024-02-08 12:57:16,Noël Antoine Sagna,BRICE,NEGOUAI,Latéral,Droit,D- Vu ,"Pas assez d'image pour bien l'évaluer, mais parait manquer un peu de vivacité , à confirmer ou pas avec d'autres images."
318,2024-02-08 13:09:57,Noël Antoine Sagna,JUSTIN,HAAK,6,Droit,C- Potentiel,"Qualités technique, oriente bien le jeu, bonne relance, bon à la récupération."
319,2024-02-08 13:45:00,Noël Antoine Sagna,RAKI,AOUANI,Ailier,Droit,C- Potentiel,"Jeune joueur avec une bonne qualité technique, dribbleur, vitesse."
320,2024-02-09 08:02:19,Noël Antoine Sagna,JACQUES AMOUR ,MBE,6,Droit,D- Vu ,Manque d'impact et de puissance dans le jeu.
321,2024-02-09 09:51:56,Noël Antoine Sagna,AKSU,DUHAN,Latéral,Gauche,D- Vu ,"Joueur calme, relance correcte mais avec un manque de vivacité, tonicité, idem pour  l'agressivité dans les duels qui manque d'impact physique, et niveau vitesse pure c'est moyen aussi."
322,2024-02-09 10:22:37,Noël Antoine Sagna,TEENAGE,HADEBE,Central,Gauche,D- Vu ,"Agressif et impact dans les duels, solide défenseur, mais trop juste techniquement pour une défense qui ressort et relance balle au pied sur du jeu court ou long. "
323,2024-02-10 09:56:24,Noël Antoine Sagna,EDGAR MIGUEL,LE,Central,Droit,D- Vu ,"Défenseur agressif, solide et vif, il est en difficulté sur ses relances, manque de justesse technique et de vitesse d'exécution dans ces moments, ses prises de décision sous pression adverse sont trop lente . Dans une équipe qui repart court de derrière, il sera en difficulté."
324,2024-02-12 07:57:00,Noël Antoine Sagna,HYSENI,MUHAMET,Attaquant,Deux pieds,C- Potentiel,"Profil intéressant, capable de jouer des 2 pieds, dans son jeu dos au but il décroche souvent pour un 1-2 et se projette derrière, il a une assez bonne qualité technique, belle présence dans la surface, appels dans le dos de la défense.
Ne connaissant pas le football Kosovar, je reste interrogatif sur le niveau du championnat.
Profil intéressant "
325,2024-02-12 08:54:37,Noël Antoine Sagna,JON, MERSINAJ,Central,Droit,C- Potentiel,"Défenseur agressif, accrocheur, pressing sur l'adversaire, qualité défensive dans le 1/1 correcte, il va vite , assez bonne relance."
331,2024-02-13 08:18:52,Noël Antoine Sagna,MIGUEL ANGELO XEKA,DA SILVA ROCHA,6,Droit,C- Potentiel,"Joueur d'expérience, qualité technique, bonne orientation du jeu, capacité à freiner la progression du ballon sur les attaques adverse par son placement et son pressing .
Par contre ca manque de vivacité, et d'explosivité, sur les phases défensives même si il peut faire preuve d'agressivité, il peut être en difficulté face à de la vitesse. Je trouve aussi qu'il manque un peu de justesse technique sur ses passes, ses transmissions qui n'arrivent pas toujours."
332,2024-02-13 08:45:20,Noël Antoine Sagna,ABDELKADER ,BOUTICHE,8,Droit,D- Vu ,"Joueur technique, joue simple et propre, mais manque de beaucoup de chose, agressivité, puissance, vitesse.... "
333,2024-02-13 12:02:52,Noël Antoine Sagna,KOEN,KOSTON,Attaquant,Deux pieds,C- Potentiel,"Joueur décrochant beaucoup, capable de remiser ou dévier dans ces moments, pour ensuite se projeter vers l'avant, capacité à faire la dernière passe en débordant ou en effectuant cette dernière dans la profondeur.
Techniquement c'est pas mal, il est capable de jouer au ballon, sa qualité de dribble est moyenne, comme son jeu de tête, ca pèche aussi dans l'adresse devant le but, ca doit cadrer beaucoup plus, et concrétiser un peu plus ses faces à face.
Profil intéressant mais......léger doute sur sa capacité à passer encore un cap pour le haut niveau.
"
334,2024-02-13 13:26:19,Noël Antoine Sagna,Evan ,Eghosa Aisowieren,8,Droit,D- Vu ,"IMPOSSIBLE A EVALUER, PAS DE VIDEOS DISPONIBLES."
335,2024-02-13 14:18:29,Noël Antoine Sagna,MOHAMED,ZOUNGRANA,6,Droit,D- Vu ,"Rien de bien transcendant, joueur moyen dans la récupération, la transmission, l'orientation du jeu.
Image vidéo mauvaise
Revoir plus tard"
336,2024-02-13 15:01:14,Noël Antoine Sagna,SANTIAGO MISAEL,NUNEZ,Central,Droit,D- Vu ,"Défenseur vif et tonique sur les appuis, en difficulté dans la relance, défends pas debout ."
337,2024-02-13 16:16:54,Noël Antoine Sagna,KEVIN MATHIAS,LEWIS RODRIGUEZ,6,Gauche,C- Potentiel,"Bonne qualité technique, bonne relance , ressort assez proprement le ballon, pas mal dans la récupération et l'orientation du jeu. 
Manque de puissance et d'impact physique dans les duels."
338,2024-02-14 15:42:39,Noël Antoine Sagna,BAPTISTE ,ROUX,Central,Droit,D- Vu ,"Bonne relance sauf sous pression, ca manque de vitesse, ca perd beaucoup de ballon quand le jeu s'accélère, manque d'impact , de vivacité, d'explosivité dans les duels."
339,2024-02-14 16:21:44,Noël Antoine Sagna,MARTIN,REA ZUCCOTTI,Central,Droit,D- Vu ,"Défenseur central avec une relance assez basic, manque d'efficacité , dégage plus le ballon qu'il ne relance sous pression, vite prit de vitesse devant des joueurs en mouvement, malgré l'expérience qu'il lui permet de gagner certains duels en déséquilibrant légèrement son adversaire.
Défenseur moyen."
340,2024-02-14 16:52:59,Noël Antoine Sagna,MARTIN,GIANOLI,Central,Gauche,D- Vu ,"Grand défenseur, utilise bien son corps pour défendre, mais manque de vitesse, vivacité, d'agressivité dans les duels, et sa relance longue est très moyenne.
Pas le profil pour relancer et joueur proprement en partant de derrière."
